news_id,seo_headline,rewritten_summary,image_prompt,image_path,image_id,tags
513546c3-d26c-4de0-b30a-c31358424fbe,Trump made Carney's turnaround victory possible,"Mark Carney's party pull off an election win that once looked near-impossible, until the US president targeted Canada.","**Illustration Prompt:**

A dramatic, slightly surreal, digital painting depicting Mark Carney, the newly elected Canadian Prime Minister, standing firmly on the border between Canada and the United States. He's positioned atop a jagged, cracked ice floe representing the fragile state of the Canadian economy, the cracks radiating outwards. He is wearing a dark, tailored suit, but with subtly distressed Canadian flag pins on his lapel. His expression is resolute, yet weary, his eyes fixed on the horizon.

In the background, on the American side of the border, a colossal, cartoonishly exaggerated Donald Trump, rendered in shades of orange and gold, is attempting to lasso the entire Canadian landscape with a rope made of red tape and menacingly large dollar bills. He has a greedy, triumphant grin. Surrounding Trump are distorted, almost caricatured symbols of American industry and consumerism: oversized cars, oil derricks pumping aggressively, and billboards flashing with garish advertisements.

Above Carney, the sky is filled with swirling storm clouds, colored with the hues of the Canadian flag (red and white), suggesting both turmoil and a fighting spirit. In contrast, the sky above Trump is a stark, almost artificial blue.

At Carney's feet, partially submerged in the icy water, are fragments of broken ""Conservative Party"" and ""Trudeau"" political signs, hinting at the defeated past. In the far distance behind Carney, silhouetted against the stormy sky, are the glimmering skylines of major European cities (Paris, Berlin), subtly suggesting a new alliance. The overall mood should be tense, a David-vs-Goliath struggle, but with an underlying sense of Canadian determination and defiance.",,513546c3-d26c-4de0-b30a-c31358424fbe,"Canada election, Mark Carney, Donald Trump, political turnaround, US-Canada relations"
5090c17c-b32a-45ff-a89f-361ef9c24541,Prince Andrew's firm linked to controversial PPE millionaire,Documents show Doug Barrowman-linked company owned the prince's start-up competition for two years.,"Illustration Prompt:

A darkly satirical and subtly chaotic scene. Prince Andrew, looking increasingly anxious and sweaty in a poorly-fitting suit, is center stage, seemingly frozen mid-pitch, microphone dangling uselessly in his hand. Behind him, a distorted, funhouse-mirror reflection of a ""Pitch@Palace"" banner warps the royal crest into something vaguely reptilian. Overlapping Andrew’s figure, partially obscuring him like a ghostly overlay, are two more defined figures: Doug Barrowman, radiating smug confidence, and Baroness Michelle Mone, sporting a faux-concerned expression and draped in a lavishly opulent (and suspiciously cheap-looking) fur coat.

Barrowman and Mone should be subtly manipulating a stack of government PPE contracts in the background, their shadows casting long, grasping fingers towards Prince Andrew. In the lower foreground, a broken, discarded dragon statuette lies amidst scattered Union Jack flags, representing the demise of Pitch@Palace. Wisps of smoke rise from the broken dragon, forming ghostly question marks. The overall color palette should be muted and vaguely sickly, with flashes of gaudy gold and the unsettling blue of corporate logos. The background suggests a grandiose but decaying hall - think Buckingham Palace but with peeling paint and exposed wiring. The entire image should convey a sense of crumbling facades, hidden dealings, and a desperate scramble for wealth amidst growing scrutiny. The overall mood is one of uneasy tension, veiled corruption, and impending collapse.",,5090c17c-b32a-45ff-a89f-361ef9c24541,"Prince Andrew, Doug Barrowman, PPE scandal, Start-up competition, Business links"
6ea67836-46e5-4436-a7f7-6dd2758139ae,Former Transgender Judge to Challenge UK Gender Ruling at European Court,"
Dr. Victoria McCloud, a former High Court Master and the UK's first openly transgender judge, is planning to challenge the recent Supreme Court ruling on biological sex at the European Court of Human Rights. Dr. McCloud argues that the Supreme Court's judgment, which defines a woman as defined by biological sex under equalities law, and the subsequent guidance issued by the equality watchdog, violate her human rights and create a legal paradox. She claims that the Supreme Court failed to adequately consider the impact of its decision on transgender individuals, as trans people were wholly excluded from the Supreme Court case and the evidence from trans activists was rejected.
Dr. McCloud contends that the Supreme Court's ruling has left her in a state of legal ambiguity, as she is recognised as a woman under the Gender Recognition Certificate but defined as a man for the purposes of the Equality Act. This, she argues, creates practical difficulties and a sense of segregation, particularly in accessing single-sex spaces and services. The equality watchdog's interim guidance, which suggests that trans women may be excluded from women's facilities and trans men from men's facilities in certain circumstances, has further exacerbated these concerns.
Dr. McCloud and other campaigners will seek a declaration from the European Court of Human Rights that the actions of the UK government and the Supreme Court judgment violate her fundamental human rights. She asserts that the Supreme Court failed to define biological sex adequately, leading to a flawed judgment with adverse consequences for transgender individuals. The case is likely to raise complex questions about the interpretation of equality law, the rights of transgender people, and the balance between competing interests in single-sex spaces.","**Illustration Prompt:**

**Scene:** A split-screen composition, dramatically lit.

**Left Side (UK):** Dominated by a stark, cold, neoclassical architectural style representing the UK Supreme Court. The architectural details should be imposing, conveying authority and tradition. Subtly illuminate a single, closed wooden door in the center. Projected onto the door is a ghostly, partially transparent silhouette of Dr. Victoria McCloud, dressed in the traditional attire of a High Court Master (robes and wig), but rendered in a desaturated, almost monochrome palette, symbolizing her sense of exclusion and being overlooked. The expression on her face, barely visible through the wig, should convey both determination and weariness. Cracks are subtly visible in the stonework around the door, suggesting the fracturing of established legal norms. Barely visible behind the door, in shadow, are several silhouettes representing cisgender people.

**Right Side (Strasbourg):** Depicts the exterior of the European Court of Human Rights in Strasbourg. The building should be rendered in a warmer, more inviting light, with subtle rainbow hues subtly refracting off the glass façade, signifying hope and inclusivity. In the foreground, Dr. Victoria McCloud, now rendered in full color and wearing civilian clothes (perhaps a tailored suit and a tasteful necklace), stands with two other figures, one Black and one of Asian descent, both looking determined but hopeful. These figures should represent the broader trans community and the international aspect of human rights law. A subtle beam of light seems to emanate from the ECHR, illuminating Dr. McCloud and her companions. They are holding symbolic suitcases, subtly embellished with trans pride flag colours, suggesting the journey to seek justice.

**Overall Mood:** The image should convey a sense of tension and high stakes. The contrast between the cold, excluding atmosphere of the UK legal system and the hopeful, inclusive ambiance of the ECHR is crucial. The illustration should powerfully symbolize Dr. McCloud's fight for transgender rights and the potential impact of this case on equality law. The use of light and shadow should be deliberate to emphasize themes of exclusion, hope, and the pursuit of justice. The subtle use of the trans pride flag colours (pink, white, and blue) should be woven into the scene discreetly, avoiding obvious or heavy-handed symbolism.",,6ea67836-46e5-4436-a7f7-6dd2758139ae,"Transgender Rights, UK Supreme Court Ruling, European Court of Human Rights, Gender Recognition Certificate, Equality Act"
466e208e-5daf-451a-a55d-7158fb69a77c,Graduates turned down by supermarkets as vacancies drop,Young people say it is harder than ever to get a job after uni with some being turned down by supermarkets.,"**Illustration Prompt:**

Create a digitally painted illustration with a somber, slightly desaturated color palette. The focal point is Faisa Ali Tarabi, a young woman of South Asian descent, wearing a graduation gown and cap but looking disheartened. She's standing in the brightly lit, sterile aisle of an Aldi supermarket. The aisle is filled with generic, stacked products, emphasizing the uniformity and impersonal nature of the setting.

In Faisa's hands, she holds a crumpled rejection email from Aldi, the text blurred but suggesting disappointment. The harsh fluorescent lighting casts long shadows on her face, highlighting the frustration in her eyes. Overlapping Faisa are ghostly, semi-transparent figures representing other graduates and young job seekers; their faces are blurred, conveying a sense of anonymity and the shared experience of unemployment. They stand in a similar supermarket aisle, looking dejected.

Subtly overlay the scene with abstract financial charts trending downward, representing the declining job market and rising employer costs. In the background, the red and blue of the Aldi logo appear muted and less vibrant than usual. A small smartphone screen is visible in the corner showing the BBC news tiktok screen, referencing online communities and shared frustration. The overall mood should be one of anxiety, disillusionment, and a hint of quiet desperation, contrasting the promise of a bright future with the harsh reality of the job market.",,466e208e-5daf-451a-a55d-7158fb69a77c,"Graduate jobs, job market, unemployment, supermarket jobs, youth employment"
14bcfc68-1831-4573-a508-22ad963c2c60,"Men should be able to carry out mammograms, specialists say",The Society of Radiographers says allowing men to do mammograms would reduce staff shortages.,"**Illustration Prompt:**

A split-screen image contrasting two scenarios within a modern NHS breast screening clinic.

**Left Side (Hope and Professionalism):** A brightly lit, clean examination room. A middle-aged woman, SALLY REED (67, kind face, short grey hair, a faint but visible mastectomy scar on one side of her chest) sits calmly, draped in a paper gown, on a mammogram machine. A MALE RADIOGRAPHER (late 20s-early 30s, professional, confident demeanor, wearing appropriate PPE) is gently positioning her breast for the scan. He maintains respectful eye contact with Sally, demonstrating a reassuring and empathetic presence. The background includes modern mammography equipment with digital displays showing X-ray images. The overall mood should be hopeful, professional, and focused on efficient healthcare delivery.

**Right Side (Concern and Skepticism):** A slightly darker, more shadowed examination room. The focus is on the concerned face of a younger woman (30s-40s, possibly ethnic minority) looking away from the scene with a worried expression. KEMI BADENOCH (Conservative leader, 40s-50s, business attire, determined expression) is faintly visible in the background, standing near a doorway and observing the scene with a concerned frown. The color palette should be slightly muted compared to the left side to convey a sense of apprehension and a potential invasion of privacy.

The split-screen should create a visual dialogue between two opposing perspectives on the issue: the potential for increased access to life-saving screenings versus the concerns around privacy and patient comfort. The overall style should be realistic, slightly stylized to emphasize the emotions, and avoid any overly sexualized or objectifying depictions of the breast area. Subtle use of light and shadow should highlight the contrasting moods and perspectives. Small details in the background, like recruitment posters for radiographers, can subtly reinforce the message of the staff shortage and the need for solutions. The color tones in the images should be subdued, as it takes place in a clinical setting, and should reflect the professional nature of mammogram screenings.",,14bcfc68-1831-4573-a508-22ad963c2c60,"Mammography, Men in Healthcare, Radiography, Staff Shortages, Healthcare Workforce"
9ac14b4e-17c8-4c20-a7df-6d48f118b742,IIT-Indore To Host Technology Translational Research Park On Digital Healthcare,"Under the aegis of NM-ICPS, IIT Indore already received a Technology Innovation Hub (TIH) back in 2021.","Okay, I need the news article first! Please provide the article text. 

Once you give me the article, I will analyze it and provide a highly descriptive illustration prompt that captures the essence of the story. The prompt will include details like:

*   **Key figures and their expressions:** (Who are the central people involved? How are they feeling – determined, heartbroken, hopeful, etc.?)
*   **Setting and atmosphere:** (Where is the story taking place? Is it a bustling city, a desolate landscape, a sterile hospital room? What's the overall mood - tense, celebratory, somber?)
*   **Action or pivotal moment:** (What is the most important event or moment that needs to be depicted? How are the characters interacting with each other or the environment?)
*   **Symbolism (if applicable):** (Are there any symbols in the story that could be visually represented to add deeper meaning?)
*   **Color palette suggestions:** (Warm tones, cool tones, muted colors, vibrant colors, etc.)
*   **Art style suggestions (if applicable):** (Realism, impressionism, surrealism, etc. based on the tone of the article.)

**Example (if the article was about a farmer losing his crops to drought):**

**Hypothetical Article Headline:** ""Dust and Despair: Drought Cripples Heartland Farms, Farmer Faces Ruin""

**Illustration Prompt:**

""A weathered and gaunt farmer, JACOB (60s), kneels in his cracked, parched field. His face is etched with deep lines of worry and exhaustion, his eyes reflecting the harsh, unforgiving sun. He clutches a handful of dry, brittle corn stalks, the kernels withered and empty. The background depicts a vast, barren landscape stretching to the horizon, dominated by shades of ochre, burnt sienna, and dusty grey. A swirling dust devil looms in the distance, further emphasizing the desolation. The sky is a pale, washed-out blue. The overall mood is one of despair and hopelessness. The style is realistic, with a focus on capturing the texture of the dry earth and the farmer's worn clothing. A single, dead sunflower lies broken at his feet, symbolizing lost hope. Consider using a desaturated color palette with subtle hints of warmth to convey the heat and dryness.""

**Waiting for your article!**",,9ac14b4e-17c8-4c20-a7df-6d48f118b742,"IIT Indore, Digital Healthcare, Technology Translational Research Park, NM-ICPS, Technology Innovation Hub"
97c35a9b-2597-4333-b217-ead1768d42f3,"Vedanta introduces cutting-edge technology to create productive, future-ready workplace","Vedanta Ltd on Tuesday said it has deployed several leading-edge technologies, including Artificial Intelligence (AI)-led monitoring systems and drones to...","Okay, please provide the news article first. Once you give me the text, I will generate a highly descriptive illustration prompt. I will focus on crafting a prompt that goes beyond generic imagery and pulls out the most impactful elements of the story.

I will aim to specify details regarding:

*   **The main subject(s) and their emotions:** How are they feeling? What are they doing?
*   **The setting:** Time of day, location specifics (building, landscape, interior).
*   **The key event or action:** What pivotal moment is being depicted?
*   **The overall mood:** Is it hopeful, somber, tense, celebratory, etc.?
*   **Symbolic elements:** Are there objects or colors that carry deeper meaning within the context of the story?
*   **Art style hints (optional):** Depending on the article's tone, should the illustration be realistic, stylized, whimsical, etc.?

Looking forward to reading the article!",,97c35a9b-2597-4333-b217-ead1768d42f3,"Vedanta, Technology, AI, Workplace, Drones"
e4874f48-c39f-441d-bbd5-a3074df3698d,"Sheriff Tom Ballinger discusses technology, community, fentanyl epidemic at Wooster Rotary","Wayne County Sheriff Tom Ballinger recently spoke at a Wooster Rotary meeting about embracing technology, building community relationships, and the ongoing...","Okay, I need the news article first!  Please provide the news article so I can generate a specific and descriptive illustration prompt. 

Once you provide the article, I will give you a prompt that includes details about:

*   **Key figures:** Specific descriptions of appearance, clothing, and posture.
*   **Setting:** Precise location, time of day, and weather conditions.
*   **Action/Event:** The most important moment captured in the illustration.
*   **Mood/Atmosphere:** Emotions conveyed through lighting, color palette, and facial expressions.
*   **Overall Composition:** A suggested arrangement of elements within the image.",,e4874f48-c39f-441d-bbd5-a3074df3698d,"Sheriff Tom Ballinger, Wayne County, fentanyl epidemic, Wooster Rotary, community relations"
b41530d9-4cea-4053-add9-540c2ec2f013,Age-verification technology could help retailers curb underage vaping,"Age-verification technology could play a key role in helping preventing underage vaping, even outside of stores, according to an independent retailer.","Okay, I need the news article first! Please provide the news article, and I will craft a highly descriptive illustration prompt based on its content. 

**Once you provide the article, I will aim for a prompt that is:**

*   **Specific:** I will extract key details like locations, characters (physical descriptions if available), time of day, and actions described in the article.
*   **Avoids Generics:** I won't use phrases like ""people doing things"" or ""scene of the event."" I will aim for evocative and precise language.
*   **Focuses on Key Elements:** The prompt will highlight the most important aspects of the story, emphasizing the core narrative and any relevant themes.
*   **Describes Mood:** I will incorporate adjectives and phrases that convey the emotional tone of the article (e.g., hopeful, somber, chaotic, tense, etc.).
*   **Detailed:** I will include information about perspective, lighting, style (e.g., realistic, painterly, graphic novel), and color palette, if relevant to the article's overall message.

**Example (if the article was about a local bakery closing):**

""Illustration: A close-up, slightly low-angle shot of a handwritten ""Closed"" sign hanging crookedly on the glass door of ""Mrs. Gable's Bakery"" on a rainy morning. The bakery interior is dimly lit, revealing empty shelves and overturned chairs in the shadows. Rain streaks down the glass, blurring the reflection of a forlorn-looking older woman (Mrs. Gable, with grey hair pulled back in a bun, wearing a faded floral apron) standing inside, wiping her eyes with a handkerchief. The color palette is muted and cool, dominated by grays, blues, and browns. Style: Realistic, painterly with soft edges, evoking a sense of loss and nostalgia.""

**So, please paste the news article and I will write your prompt!**",,b41530d9-4cea-4053-add9-540c2ec2f013,"Age-verification, Vaping, Underage vaping, Retail technology, Tobacco control"
92da6493-df70-4e50-b2d0-b027c60b2c9a,Eric Semler Calls Viant Technology a Zombie Company That Should Embrace a BTC Treasury,The Semler Scientific chairman flagged the ad tech firm as ripe for a bitcoin treasury strategy amid stock struggles and cash stockpile.,"Okay, you need to provide me with the news article first! I can't generate an illustration prompt without knowing what the story is about. 

**Once you provide the article, I will give you a highly descriptive prompt that includes:**

*   **Key Figures:** Descriptions of specific individuals involved, their clothing, expressions, and actions.
*   **Setting:** Detailed descriptions of the location, time of day, weather, and atmosphere.
*   **Action/Event:** The core event being depicted, including movement, interaction, and any relevant objects.
*   **Mood/Tone:** The overall emotion the illustration should evoke (e.g., hope, despair, tension, triumph).
*   **Specific Details:** Unique elements mentioned in the article that will make the illustration stand out.
*   **Art Style Considerations:** Suggestions for art style to fit the tone (e.g., realistic, impressionistic, stylized, etc.)

**Example (If the article were about a firefighter rescuing a cat from a burning building):**

**Illustration Prompt (Example):**

""Illustration depicting a heroic firefighter, soot-stained and determined, emerging from the doorway of a burning two-story house engulfed in orange flames and thick, black smoke. The firefighter is wearing full gear, a reflective jacket catching the light, and cradles a small, terrified ginger cat in their arms. The house behind them is crumbling, with a partially collapsed roof and shattered windows spewing smoke. Embers swirl in the air. The sky is a hazy orange from the fire's glow. Focus on the contrast between the firefighter's bravery and the cat's vulnerability. Use a semi-realistic painting style with strong lighting and dramatic shadows to convey a sense of urgency and danger, while still showcasing the firefighter's compassion. Capture the warmth of the fire contrasting with the cool tones of the firefighter's uniform. Add details like a child's teddy bear visible through a broken window to enhance the emotional impact.""

**I'm ready when you are! Just paste the news article.**",,92da6493-df70-4e50-b2d0-b027c60b2c9a,"Eric Semler, Viant Technology, Bitcoin Treasury, BTC, Zombie Company"
48654639-7f18-4a2a-a60d-8654e5aeabb0,Trump made Carney's turnaround victory possible,"Mark Carney's party pull off an election win that once looked near-impossible, until the US president targeted Canada.","Here's a prompt for an illustration image inspired by the news article, designed to be highly descriptive and evocative:

**Illustration Prompt:**

A dramatic, almost theatrical composition depicting Mark Carney, newly elected Prime Minister of Canada, standing at a podium bathed in a stark, cool spotlight. He's mid-speech, his expression a mixture of steely determination and wary concern. The backdrop behind him is divided: On one side, a stylized, distressed Canadian flag appears to be slowly unraveling or fraying at the edges. On the other side, a menacing, larger-than-life shadow of Donald Trump looms – his silhouette exaggerated with sharp angles and an almost predatory posture, perhaps with a hint of an ""Uncle Sam"" hat askew on his head to emphasize the threat to Canadian sovereignty.

The podium itself should be subtly decorated with a maple leaf design that seems to be cracking or under pressure. In the foreground, at the base of the podium, are scattered items representing Canadian identity and resources: a crumpled hockey puck, a small pile of stylized wheat (representing agriculture), and a tiny, forlorn totem pole seemingly cast in shadow.

The color palette should be primarily cool blues and greys for the Canadian side, suggesting anxiety and vulnerability, contrasted with harsh reds and oranges highlighting Trump's silhouette, to depict the perceived aggression. The spotlight on Carney should be a sharp, focused white, creating a sense of isolation and highlighting the immense pressure he faces. The overall mood should be tense, defiant, and slightly surreal, conveying the sense of Canada standing alone against a powerful, unpredictable force threatening its identity. The artwork should strive for a sense of political drama and the weight of history.",,48654639-7f18-4a2a-a60d-8654e5aeabb0,"Canadian Election, Mark Carney, Donald Trump, Canada-US Relations, Political Turnaround"
