news_id,seo_headline,rewritten_summary,image_prompt,image_path,image_id,tags
43f50a4e-f75c-404a-bf8c-f48a9f78ed8e,Prince Andrew's firm linked to controversial PPE millionaire,Documents show Doug Barrowman-linked company owned the prince's start-up competition for two years.,"**Illustration Prompt:**

A darkly satirical illustration depicting Prince Andrew, sweating slightly and dressed in a rumpled suit, standing precariously on a crumbling stage. He gestures grandly towards a row of shadowy figures seated behind a long table – representing potential investors – their faces obscured by darkness. Behind him, a faded and peeling banner reads ""Pitch@Palace Global: Unleash Your Potential!"" with a crown logo partially obscured by dripping black paint.

In the foreground, a sharply dressed Doug Barrowman, with a sly smirk, is visibly puppeteering Prince Andrew using marionette strings. The strings are made of intertwined pound sterling notes and surgical masks (alluding to the PPE scandal). Barrowman's other hand is concealed behind his back, clutching a document labeled ""Knox House Trustees (UK)"" with a skull and crossbones subtly overlaid on the company logo.

In the corner, a single, discarded microphone lies on the floor, symbolizing the silenced Pitch@Palace initiative. A faint, ethereal glow emanates from the microphone, hinting at the potential once held by aspiring entrepreneurs.

The overall mood should be one of seedy opulence, hinting at corruption and the exploitation of opportunity. The background should be dimly lit, with shadows playing across the scene, suggesting hidden agendas and illicit dealings. Subtle details like leaked documents and tax evasion forms scattered around the stage would amplify the story's themes of financial impropriety and shady business practices. The illustration style should be realistic with a slight caricature element to emphasize the satire.",,43f50a4e-f75c-404a-bf8c-f48a9f78ed8e,"Prince Andrew, Doug Barrowman, PPE, Start-up Competition, Business"
98e1e3cc-ebaa-492f-b073-3ea33453769d,Graduates turned down by supermarkets as vacancies drop,Young people say it is harder than ever to get a job after uni with some being turned down by supermarkets.,"**Illustration Prompt:**

A split composition.

**Left Side (Darker, More Despondent):** Close-up of Faisa Ali Tarabi (24, Bolton), sitting at a cluttered desk in a dimly lit bedroom. Her face is a mixture of exhaustion and quiet frustration. She is surrounded by rejection emails displayed on a laptop screen and scattered paper applications. The background subtly shows a diploma from the University of Salford and a masters degree from Manchester Metropolitan University hanging on the wall, but they are slightly out of focus, emphasizing her current predicament.  The overall color palette here should lean towards greys, blues, and muted browns to convey a sense of stagnation and disappointment. A discarded, unopened letter bearing the Aldi logo sits on the desk, further highlighting her rejection.

**Right Side (Brighter, More Foreboding):** Wide shot depicting the interior of a bustling, brightly lit Aldi supermarket.  However, instead of happy shoppers, the focus is on empty checkout lanes and fewer staff members than usual.  The shelves are fully stocked, but the staff appear overworked and stressed. A prominent sign in the background reads ""Hiring Freeze - Due to Rising Costs."" The right side's palette should be dominated by the harsh, fluorescent lighting of the supermarket, creating a sense of coldness and an uncaring corporate environment.  In the corner of the image, barely visible, are shadows representing the potential job losses referred to in the article.

**Overall Mood and Composition:** The split composition should visually represent the disconnect between individual aspirations and the current economic reality. The contrast between Faisa's personal struggle and the impersonal, economically driven decisions of the supermarket highlights the human cost of the situation. The overall mood should be one of anxious uncertainty, mirroring the insecurity felt by young graduates facing a shrinking job market. The composition should lead the viewer's eye from the despair of Faisa's situation to the sterile, yet equally bleak, reality of the supermarket. The style should be realistic and contemporary, avoiding overly stylized or abstract representations. Focus on capturing genuine emotion and a sense of quiet desperation.",,98e1e3cc-ebaa-492f-b073-3ea33453769d,"graduate jobs, job market, supermarket jobs, youth unemployment, recent graduates"
9e4c3f5c-5221-4262-acf0-02169a186e98,"Men should be able to carry out mammograms, specialists say",The Society of Radiographers says allowing men to do mammograms would reduce staff shortages.,"**Illustration Prompt:**

**Scene:** A brightly lit, modern mammography suite within a public hospital. The color palette is calming: soft blues, greens, and whites.

**Central Focus:** A middle-aged woman, SALLY REED (67, based on the article description), is seated comfortably in front of a state-of-the-art mammography machine. Her expression is resolute and positive, but with a hint of vulnerability. She's wearing a hospital gown that is slightly open at the chest.

**Foreground:** A radiographer, a kind-faced MAN in his late 20s or early 30s wearing a clean, professional uniform, is gently positioning her breast for the scan. His expression is focused, professional, and empathetic. He maintains respectful distance, highlighting his professionalism. His name tag subtly reads ""David"".

**Background:** In the blurred background, a female radiographer (SUE JOHNSON - based on article description), in her 40s, possibly of African descent, is observing the scene from a slightly further distance. She's holding a clipboard and has a thoughtful, optimistic expression. In the very far background (blurred), suggest a poster about the benefits of mammography and NHS recruitment materials that show both male and female radiographers.

**Overall Mood:** The scene should convey a sense of hope, progress, and reassurance. Emphasize the professionalism of the male radiographer, the comfort and trust of the patient, and the supportive atmosphere. Avoid any hint of sexualization or discomfort. The image should be both informative and empowering. It showcases the potential for inclusive healthcare while respecting patient autonomy and choice.

**Specific Details:**

*   The mammography machine should be a modern, clean-looking model.
*   Ensure the lighting is bright and clinical, but not harsh.
*   Pay careful attention to body language to convey professionalism and respect.
*   The overall composition should highlight the idea of progress and addressing staff shortages in a compassionate and professional way.",,9e4c3f5c-5221-4262-acf0-02169a186e98,"Mammography, Men in healthcare, Radiography, Staff shortages, Healthcare workforce"
e0b6e365-d215-41a4-85d7-6ad75f20f9ac,Some M&S stores left with empty shelves after cyber attack,The BBC understands M&amp;S's operations will take until the end of the week before beginning to return to normal.,"**Illustration Prompt:**

**Scene:** A brightly lit, but sparsely stocked, M&S food hall aisle. It is late afternoon, golden hour light streaming weakly through the large windows.

**Focus:** A middle-aged woman with frazzled auburn hair, wearing a slightly creased floral dress, stands forlornly in front of a near-empty shelf labeled ""BBQ Essentials."" Her shopping basket, a reusable M&S tote, contains only a lone bag of crisps. She holds her mobile phone in her hand, its screen displaying a paused M&S shopping app, a frustrated expression etched on her face.

**Surrounding Details:** The shelves around her are noticeably bare, with gaps and scattered items. A single, wilted-looking pepper sits forlornly on one shelf. A digital price scanner nearby displays an error message. Behind her, another shopper, a young man in shorts and a t-shirt, shrugs with disappointment at a depleted display of gardening tools. A discarded ""Click & Collect"" ticket lies crumpled on the floor near his feet.

**Mood:** A palpable sense of disappointment and mild frustration permeates the scene. The overall color palette should be warm but tinged with a sense of emptiness. Subtly incorporate a faint, digital ""glitch"" effect around the digital screen and the price scanner, hinting at the cyber attack.

**Style:** Realistic but slightly stylized, like a candid street photography image. The overall feeling should be relatable and human, highlighting the everyday impact of the cyber attack on ordinary shoppers.",,e0b6e365-d215-41a4-85d7-6ad75f20f9ac,"M&S, Marks and Spencer, cyber attack, supply chain, retail"
afa68a26-d8fb-4081-877d-544026711b0b,Singapore Airlines upgrades customer support with AI technology,AI tools from OpenAI will enhance Singapore Airlines' virtual assistant for better customer service.,"Okay, you haven't provided the article yet. To give you the best prompt, I need the text of the news article!

However, I can give you a *template* for the kind of descriptive prompt I would create, assuming a hypothetical article about a small town facing economic hardship due to a factory closure:

**Here's the template:**

""**Illustration:** A poignant and evocative illustration depicting the Main Street of [Town Name], bathed in the fading light of a late autumn afternoon. In the foreground, a young woman, [Approximate Age], with tired eyes and wearing worn work boots and a faded [Factory Name] t-shirt, stands near the closed gates of the factory. The factory, a hulking brick building, is silhouetted against a fiery sunset, but its windows are dark and lifeless. Dust devils swirl across the deserted parking lot.  Behind her, Main Street stretches into the distance, lined with struggling businesses: a boarded-up diner, a grocery store with sparsely stocked shelves, and a few somber-looking figures walking with bowed heads. A single, flickering streetlight casts a long, lonely shadow. The overall mood is one of quiet desperation, reflecting the lost hope and uncertainty hanging over the town. The style should be reminiscent of a [Specific Art Style, e.g., Edward Hopper realism or a melancholic watercolor style]. Emphasize the textures of the brick, the worn fabric, and the bleakness of the landscape. Color palette should be muted grays, browns, and oranges, with a touch of cold blue in the shadows. The lighting should be dramatic, with long shadows and a strong contrast between light and dark.""

**Here's what changes based on the actual article:**

*   **[Town Name] and [Factory Name]:** These are replaced with the actual names from the article.
*   **[Approximate Age] and Specific Description:** This is replaced with the age and a detailed description of a key person mentioned in the article (a laid-off worker, a business owner, etc.).
*   **Specific Details:** The details about the buildings, people, and environment are tailored to match the specific details in the article. If the article mentions a specific landmark, include it. If it mentions a specific event, show it.
*   **[Specific Art Style]:** Choose an art style that complements the tone and subject matter of the article.
*   **Color Palette:** The color palette should be chosen to evoke the desired mood (e.g., hopeful colors for a story about recovery, somber colors for a story about loss).
*   **The Main Focus:** Emphasize the central theme and message of the news article visually. If it's about community resilience, show people helping each other. If it's about the failure of a system, show the broken pieces of that system.

**Provide the article, and I will give you a much more precise and effective prompt.**",,afa68a26-d8fb-4081-877d-544026711b0b,"Singapore Airlines, AI, Customer Service, OpenAI, Virtual Assistant"
cde5480c-d7f3-422d-bd8d-509a012bb72d,IIT-Indore To Host Technology Translational Research Park On Digital Healthcare,"Under the aegis of NM-ICPS, IIT Indore already received a Technology Innovation Hub (TIH) back in 2021.","Okay, you need to provide the news article for me to generate the illustration prompt.  

However, I can give you a template and some examples of the *type* of prompts I would create. Once you paste in the article, I can tailor it perfectly.

Here's the breakdown:

**Template for the Prompt:**

`Digital illustration, [Style - e.g., realistic, painterly, cartoonish, art deco, cyberpunk, impressionistic, etc.], capturing the [Mood - e.g., somber, hopeful, tense, chaotic, triumphant, etc.] atmosphere of [Brief summary of the core event/situation]. The central focus is on [Specific Key Figure 1] and [Specific Key Figure 2, if relevant], depicted [Action/Pose/Expression of Figure 1] and [Action/Pose/Expression of Figure 2]. The background should feature [Specific Location Detail 1 - e.g., a dilapidated building with graffiti], [Specific Location Detail 2 - e.g., a field of sunflowers wilting under a stormy sky], and [Key Object/Symbol that represents the theme - e.g., a broken clock, a single dove, a flickering screen, a stack of books]. Use a [Color Palette - e.g., muted grays and blues with pops of red, warm golds and oranges, vibrant neon colors, etc.] to emphasize the [Specific aspect of the story/mood - e.g., desperation, resilience, innovation, etc.].  Lighting should be [Type of Lighting - e.g., harsh sunlight, soft candlelight, ominous shadows, etc.] to create [Desired Effect - e.g., a sense of foreboding, a feeling of intimacy, a stark contrast]. Inspired by [Artist/Style Inspiration - e.g., Greg Rutkowski, Studio Ghibli, Art Nouveau, etc.]`

**Examples (without a specific article, so they are generic):**

*   **Example 1 (Generic - Needs Article to be Specific):** `Digital illustration, realistic, capturing the somber atmosphere of a town struggling after a major factory closure. The central focus is on a weary-looking factory worker, standing outside the closed gates, holding a tattered lunch pail. The background should feature boarded-up storefronts, a gray sky, and a distant silhouette of the now-idle factory. Use a muted gray and blue color palette to emphasize the feeling of despair. Lighting should be harsh sunlight creating long, dramatic shadows. Inspired by Edward Hopper.`

*   **Example 2 (Generic - Needs Article to be Specific):** `Digital illustration, cartoonish, capturing the hopeful atmosphere of a community garden project. The central focus is on two children, a young girl planting a seedling and a young boy watering it, both smiling brightly. The background should feature rows of vegetables, a colorful mural on a nearby wall, and a group of volunteers working in the distance. Use a vibrant green and yellow color palette to emphasize the feeling of growth and community. Lighting should be soft and diffused, creating a warm and inviting scene. Inspired by Studio Ghibli.`

**Key Considerations for When You Provide the Article:**

*   **Who are the main actors?** Focus on their expressions and actions.
*   **What is the central event?** Depict the most crucial moment or situation.
*   **Where does the story take place?** Ground the image in a specific location, adding details that are relevant to the narrative.
*   **What is the tone or mood?** Choose colors, lighting, and stylistic elements to convey the right emotion.
*   **What are some symbolic objects or images that represent the themes of the story?**

**Paste the article here, and I'll create a highly descriptive and effective illustration prompt for you!**",,cde5480c-d7f3-422d-bd8d-509a012bb72d,"IIT Indore, Digital Healthcare, Technology Translational Research Park, NM-ICPS, Technology Innovation Hub"
16cd5e2a-8037-4379-bc0e-0f4e1638fe07,"Vedanta introduces cutting-edge technology to create productive, future-ready workplace","Vedanta Ltd on Tuesday said it has deployed several leading-edge technologies, including Artificial Intelligence (AI)-led monitoring systems and drones to...","Okay, please provide the news article! I need the text of the article to generate the illustration prompt. 

Once you provide the article, I will create a detailed prompt including elements like:

*   **Key People:** Specific descriptions of their appearance, emotions, and actions relevant to the article.
*   **Setting:** A detailed depiction of the place where the main event occurred. Include time of day, weather, and atmosphere.
*   **Action/Event:** The core event from the article should be visually represented. Focus on the most impactful moment.
*   **Mood/Atmosphere:** A specific tone that reflects the news (e.g., hope, despair, tension, relief). Consider using lighting, colors, and composition to achieve the desired mood.
*   **Symbolism:** If there are symbols or metaphors in the article, I'll suggest ways to visually represent them.
*   **Style (Optional):** If you have a specific artistic style in mind (e.g., photorealistic, cartoon, watercolor), you can tell me, and I will incorporate it into the prompt.

I look forward to helping you create the perfect illustration prompt!",,16cd5e2a-8037-4379-bc0e-0f4e1638fe07,"Vedanta, Artificial Intelligence, Workplace Technology, Drones, Industrial Innovation"
db2db568-b63a-43e4-b25a-138109eee4d4,"Sheriff Tom Ballinger discusses technology, community, fentanyl epidemic at Wooster Rotary","Wayne County Sheriff Tom Ballinger recently spoke at a Wooster Rotary meeting about embracing technology, building community relationships, and the ongoing...","Okay, I need the news article! Please provide the news article text. Once you give me the article, I will generate a highly descriptive illustration prompt based on its content.

For example, let's pretend this is the article:

**Article:** *Local Beekeeper, Agnes Plumtree, Wins National Honey Award After Bee Colony Recovers From Mysterious Pesticide Poisoning*

*Willow Creek, OR - Agnes Plumtree, a 78-year-old beekeeper from Willow Creek, Oregon, has won the prestigious ""Golden Comb"" award at the National Honey Convention in Denver, Colorado. This victory comes after a devastating setback last spring when Agnes's prized honeybee colony suffered a near-fatal poisoning, suspected to be from agricultural pesticides used in nearby fields. Plumtree spent months painstakingly nursing her bees back to health, using a unique blend of organic supplements and old-fashioned beekeeping techniques passed down from her grandmother. The award recognizes not only the exceptional quality of Plumtree's honey – a rich, wildflower blend – but also her resilience and dedication to bee conservation. A tearful Plumtree dedicated the award to her bees, saying, ""They are the real winners. I just helped them along."" The victory comes amidst growing concerns about the impact of pesticides on bee populations nationwide.*

Here's an example of a prompt I might generate from that article:

**Illustration Prompt Example:**

""A heartwarming, slightly painterly illustration depicting Agnes Plumtree, a 78-year-old woman with kind eyes, wrinkles around her mouth from smiling, and silver hair pulled back in a practical bun. She's wearing a well-worn beekeeping suit, slightly dusted with pollen, and holding a golden, intricately designed 'Golden Comb' award. Behind her, slightly out of focus but clearly visible, is her beehive, painted a cheerful shade of robin's egg blue. The hive is overflowing with healthy, buzzing bees. Sunlight streams through the lush, green foliage of a wildflower meadow surrounding the hive, suggesting a recovered and thriving ecosystem. In the lower right corner, partially obscured by wildflowers, is a discarded, rusted pesticide container with a faded warning label. Agnes's expression is a mix of joy and quiet triumph, with a single tear tracing a path down her cheek. The overall mood is hopeful and resilient, highlighting the recovery of the bees and Agnes's connection to them. The color palette should be warm and inviting, dominated by golds, greens, blues, and honeyed yellows. Art style: Inspired by Golden Age illustration, but with a modern, slightly textured feel.""

**Now, please provide the news article you want me to work with.**",,db2db568-b63a-43e4-b25a-138109eee4d4,"Sheriff Tom Ballinger, Wayne County, Wooster Rotary, Fentanyl Epidemic, Community Policing"
5e4b48f7-765e-414e-8bba-6e4d05f6f7e3,Age-verification technology could help retailers curb underage vaping,"Age-verification technology could play a key role in helping preventing underage vaping, even outside of stores, according to an independent retailer.","Okay, to give you the best possible illustration prompt, I need the news article! Please paste the text of the news article here, and I'll generate a highly descriptive illustration prompt for it.

**Example:**

Let's say your news article was this:

**""Local Bakery Owner Celebrates 100th Birthday, Credits Hard Work and Cinnamon Rolls""**

*Sarah Miller, owner of Miller's Bakery in the heart of downtown Willow Creek, celebrated her 100th birthday today surrounded by family, friends, and a mountain of her famous cinnamon rolls. The bakery, a Willow Creek institution for over 75 years, has been run by Sarah since she inherited it from her parents. In an emotional speech, Sarah attributed her longevity to 'hard work, good friends, and of course, a daily cinnamon roll.'  Mayor Thompson presented Sarah with a key to the city, noting her contributions to the community and the bakery's role as a gathering place. Longtime customers lined up down Main Street to offer their congratulations and purchase a celebratory, specially priced cinnamon roll.""*

Here's a sample prompt I might generate based on that article:

**Illustration Prompt (Based on Sample Article):**

""Create a vibrant and heartwarming illustration depicting Sarah Miller, a kind-faced, elderly woman with bright eyes and a warm smile, celebrating her 100th birthday at Miller's Bakery in Willow Creek. She is wearing a light blue floral dress and a pearl necklace.  Around her, family, friends, and customers are gathered, offering congratulations and enjoying the bakery's festive atmosphere. In the foreground, a towering pyramid of golden-brown, glazed cinnamon rolls dominates the scene, some with candles on top.  Mayor Thompson is presenting Sarah with a golden key to the city, holding it out with a respectful and admiring expression.  The background shows the classic, inviting facade of Miller's Bakery, with its red brick exterior, large windows displaying pastries, and a vintage ""Miller's Bakery"" sign. Long lines of customers stretch down Main Street, eagerly awaiting their turn to enter. The overall mood should be joyful, celebratory, and nostalgic, capturing the bakery's role as a beloved community hub. Use a warm color palette with highlights on the cinnamon rolls and Sarah's face to emphasize the sweetness and her vitality. Consider a slightly painterly style to evoke a sense of timelessness and tradition.""

**Now, please provide the news article you want me to work with!**",,5e4b48f7-765e-414e-8bba-6e4d05f6f7e3,"Age Verification, Underage Vaping, Retail Technology, E-Cigarettes, Vape Prevention"
